{
  "blocked_or_unsupported": [
    {
      "reason_category": "out_of_envelope",
      "scope": "entire case: heavy-duty diesel application",
      "scope_type": "request",
      "state": "unsupported"
    }
  ],
  "case_id": "CAS-SYNTH-004",
  "contract_version": "0",
  "created_from": {
    "input_content_type": "application/json",
    "input_digest": "sha256:ca93ebdd99f265a0c1a40bb3de4f1a60306341eb04b6bf92c3baf1cd9a3ff415",
    "input_item_count": 1
  },
  "derived": {
    "contradictions": [],
    "descriptive_absences": [],
    "known_facts": [],
    "material_unknowns": []
  },
  "evidence": [
    {
      "category": "reported_concern",
      "id": "EV-SYNTH-001",
      "lifecycle_status": "NORMALIZED",
      "provenance": {
        "observed_at": "2026-07-01T08:45:00Z",
        "reporter_role": "service_advisor",
        "source_class": "CUSTOMER_REPORT"
      },
      "rights_status": "RIGHTS.CLEAN_ORIGINAL",
      "statement": "Customer reports low power in a synthetic heavy-duty diesel truck; entirely invented case."
    }
  ],
  "receipt_id": "RCPT-SYNTH-004",
  "rights_summary": {
    "lifecycle_statuses": [
      "NORMALIZED"
    ],
    "rights_statuses": [
      "RIGHTS.CLEAN_ORIGINAL"
    ],
    "source_classes": [
      "CUSTOMER_REPORT"
    ]
  },
  "status": "unsupported",
  "tenant_id": "TEN-SYNTH-001"
}
