{
  "blocked_or_unsupported": [],
  "case_id": "CAS-SYNTH-0042",
  "contract_version": "0",
  "created_from": {
    "input_content_type": "application/json",
    "input_digest": "sha256:705ee95ce27b5adad5326df8fa34d465c6a6a4b9bb0626fbb3dbe907fa664a5f",
    "input_item_count": 5
  },
  "derived": {
    "contradictions": [],
    "descriptive_absences": [
      {
        "category": "measurement_evidence",
        "description": "No first-party fuel pressure reading with units and conditions is present in the supplied inputs."
      }
    ],
    "known_facts": [
      {
        "evidence_ids": [
          "EV-SYNTH-003",
          "EV-SYNTH-004"
        ],
        "statement": "A low-fuel-pressure generic code family and a recorded commanded-versus-actual fuel pressure divergence are both present."
      }
    ],
    "material_unknowns": [
      {
        "category": "operating_context_evidence",
        "description": "The fuel level and recent cold-weather exposure at the time of the synthetic concern are unknown."
      }
    ]
  },
  "evidence": [
    {
      "category": "reported_concern",
      "id": "EV-SYNTH-001",
      "lifecycle_status": "NORMALIZED",
      "provenance": {
        "observed_at": "2026-07-02T08:00:00Z",
        "reporter_role": "shop_system",
        "source_class": "SHOP_SYSTEM_RECORD"
      },
      "rights_status": "RIGHTS.CLEAN_ORIGINAL",
      "statement": "Synthetic repair-order concern line: engine cranks longer than normal before starting when cold."
    },
    {
      "category": "operating_context",
      "id": "EV-SYNTH-002",
      "lifecycle_status": "NORMALIZED",
      "provenance": {
        "observed_at": "2026-07-02T08:00:00Z",
        "reporter_role": "shop_system",
        "source_class": "SHOP_SYSTEM_RECORD"
      },
      "rights_status": "RIGHTS.CLEAN_ORIGINAL",
      "statement": "Synthetic shop-management platform case: invented light-duty gasoline pickup, invented odometer band, no real vehicle or shop."
    },
    {
      "category": "dtc_family",
      "id": "EV-SYNTH-003",
      "lifecycle_status": "NORMALIZED",
      "provenance": {
        "observed_at": "2026-07-02T08:40:00Z",
        "reporter_role": "technician",
        "source_class": "SCAN_TOOL_OUTPUT"
      },
      "rights_status": "RIGHTS.FIRST_PARTY_OBSERVED",
      "statement": "Generic powertrain code family P0087 (fuel rail/system pressure too low) stored as history."
    },
    {
      "category": "scan_observation",
      "id": "EV-SYNTH-004",
      "lifecycle_status": "NORMALIZED",
      "provenance": {
        "observed_at": "2026-07-02T08:45:00Z",
        "reporter_role": "technician",
        "source_class": "SCAN_TOOL_OUTPUT"
      },
      "rights_status": "RIGHTS.FIRST_PARTY_OBSERVED",
      "statement": "Recorded scan data shows commanded and actual fuel pressure diverging under higher engine load."
    },
    {
      "category": "completed_test_result",
      "id": "EV-SYNTH-005",
      "lifecycle_status": "NORMALIZED",
      "provenance": {
        "reporter_role": "shop_system",
        "source_class": "SHOP_SYSTEM_RECORD",
        "tested_at": "2026-07-02T09:00:00Z"
      },
      "rights_status": "RIGHTS.CLEAN_ORIGINAL",
      "statement": "Repair-order notes state a fuel filter service-history review was completed for this synthetic case."
    }
  ],
  "receipt_id": "RCPT-SYNTH-005",
  "rights_summary": {
    "lifecycle_statuses": [
      "NORMALIZED"
    ],
    "rights_statuses": [
      "RIGHTS.CLEAN_ORIGINAL",
      "RIGHTS.FIRST_PARTY_OBSERVED"
    ],
    "source_classes": [
      "SCAN_TOOL_OUTPUT",
      "SHOP_SYSTEM_RECORD"
    ]
  },
  "status": "completed",
  "tenant_id": "TEN-SHOPSYNTH-001"
}
