{
  "blocked_or_unsupported": [],
  "case_id": "CAS-SYNTH-001",
  "contract_version": "0",
  "created_from": {
    "input_content_type": "application/json",
    "input_digest": "sha256:d38a24a6bd0a12d9c3e6f5fda3147f181d979ddfa93c74bbfdd1826b3d60c61f",
    "input_item_count": 1
  },
  "derived": {
    "contradictions": [],
    "descriptive_absences": [],
    "known_facts": [],
    "material_unknowns": []
  },
  "evidence": [
    {
      "category": "reported_concern",
      "id": "EV-SYNTH-001",
      "lifecycle_status": "NORMALIZED",
      "provenance": {
        "observed_at": "2026-07-01T09:00:00Z",
        "reporter_role": "service_advisor",
        "source_class": "CUSTOMER_REPORT"
      },
      "rights_status": "RIGHTS.CLEAN_ORIGINAL",
      "statement": "Customer reports the engine is hard to start after sitting overnight."
    }
  ],
  "receipt_id": "RCPT-SYNTH-001",
  "rights_summary": {
    "lifecycle_statuses": [
      "NORMALIZED"
    ],
    "rights_statuses": [
      "RIGHTS.CLEAN_ORIGINAL"
    ],
    "source_classes": [
      "CUSTOMER_REPORT"
    ]
  },
  "status": "completed",
  "tenant_id": "TEN-SYNTH-001"
}
